{
  "schema_version": 1,
  "profile_name": "pfsense-firewall",
  "display_name": "Pfsense Firewall",
  "description": "pfSense Firewall Appliance Stats (bsnmpd / PF-MIB)",
  "vendor": "pfSense",
  "device_classes": [
    "firewall"
  ],
  "state": "experimental",
  "detection": {
    "sys_object_id_prefixes": [
      "1.3.6.1.4.1.12325"
    ],
    "sys_descr_regexes": [
      "(?i)pfSense"
    ],
    "required_oids": [
      "1.3.6.1.2.1.1.2.0"
    ],
    "optional_oids": [],
    "priority": 20,
    "minimum_confidence": 0.8
  },
  "poll": {
    "defaults": {
      "timeout_ms": 1000,
      "retries": 1,
      "max_parallel": 4,
      "budget_weight": 1
    }
  },
  "scalars": {
    "pf_states_current": {
      "oid": "1.3.6.1.4.1.12325.1.200.1.3.1.0",
      "type": "integer",
      "unit": "amps",
      "scale": 1,
      "transform": null,
      "metric": "pf_states_current",
      "required": false,
      "priority": 0,
      "timeout_ms": null
    },
    "pf_states_searches": {
      "oid": "1.3.6.1.4.1.12325.1.200.1.3.2.0",
      "type": "counter",
      "unit": "count",
      "scale": 1,
      "transform": null,
      "metric": "pf_states_searches",
      "required": false,
      "priority": 0,
      "timeout_ms": null
    },
    "pf_states_inserts": {
      "oid": "1.3.6.1.4.1.12325.1.200.1.3.3.0",
      "type": "counter",
      "unit": "count",
      "scale": 1,
      "transform": null,
      "metric": "pf_states_inserts",
      "required": false,
      "priority": 0,
      "timeout_ms": null
    },
    "pf_states_removals": {
      "oid": "1.3.6.1.4.1.12325.1.200.1.3.4.0",
      "type": "counter",
      "unit": "count",
      "scale": 1,
      "transform": null,
      "metric": "pf_states_removals",
      "required": false,
      "priority": 0,
      "timeout_ms": null
    },
    "pf_counter_match": {
      "oid": "1.3.6.1.4.1.12325.1.200.1.2.1.0",
      "type": "counter",
      "unit": "count",
      "scale": 1,
      "transform": null,
      "metric": "pf_counter_match",
      "required": false,
      "priority": 0,
      "timeout_ms": null
    },
    "pf_counter_bad_offset": {
      "oid": "1.3.6.1.4.1.12325.1.200.1.2.2.0",
      "type": "counter",
      "unit": "count",
      "scale": 1,
      "transform": null,
      "metric": "pf_counter_bad_offset",
      "required": false,
      "priority": 0,
      "timeout_ms": null
    },
    "pf_counter_fragment": {
      "oid": "1.3.6.1.4.1.12325.1.200.1.2.3.0",
      "type": "counter",
      "unit": "count",
      "scale": 1,
      "transform": null,
      "metric": "pf_counter_fragment",
      "required": false,
      "priority": 0,
      "timeout_ms": null
    }
  },
  "tables": {
    "pf_interfaces": {
      "base_oid": "1.3.6.1.4.1.12325.1.200.1.8.2.1",
      "index_strategy": "integer",
      "columns": {
        "index": {
          "oid_suffix": "1",
          "type": "integer",
          "unit": "count",
          "scale": 1,
          "transform": null,
          "metric": "pf_interfaces.index"
        },
        "if_name": {
          "oid_suffix": "2",
          "type": "string",
          "unit": "text",
          "scale": 1,
          "transform": null,
          "metric": "pf_interfaces.if_name"
        },
        "cleared_timestamp": {
          "oid_suffix": "3",
          "type": "integer",
          "unit": "count",
          "scale": 1,
          "transform": null,
          "metric": "pf_interfaces.cleared_timestamp"
        },
        "references": {
          "oid_suffix": "4",
          "type": "integer",
          "unit": "count",
          "scale": 1,
          "transform": null,
          "metric": "pf_interfaces.references"
        }
      },
      "max_rows": 256,
      "cost": 10
    }
  },
  "traps": []
}
