{
  "schema_version": 1,
  "profile_name": "raritan-pdu",
  "display_name": "Raritan Pdu",
  "description": "Raritan Intelligent Rack Power Distribution Unit (PDU)",
  "vendor": "Raritan",
  "device_classes": [
    "pdu"
  ],
  "state": "experimental",
  "detection": {
    "sys_object_id_prefixes": [
      "1.3.6.1.4.1.13742"
    ],
    "sys_descr_regexes": [
      "(?i)Raritan"
    ],
    "required_oids": [
      "1.3.6.1.2.1.1.2.0"
    ],
    "optional_oids": [],
    "priority": 20,
    "minimum_confidence": 0.8
  },
  "poll": {
    "defaults": {
      "timeout_ms": 1000,
      "retries": 1,
      "max_parallel": 4,
      "budget_weight": 1
    }
  },
  "scalars": {
    "pdu_model": {
      "oid": "1.3.6.1.4.1.13742.6.3.2.1.1.2.1",
      "type": "string",
      "unit": "text",
      "scale": 1,
      "transform": null,
      "metric": "pdu_model",
      "required": false,
      "priority": 0,
      "timeout_ms": null
    }
  },
  "tables": {
    "inlet_phases": {
      "base_oid": "1.3.6.1.4.1.13742.6.5.2.3.1",
      "index_strategy": "integer",
      "columns": {
        "index": {
          "oid_suffix": "1",
          "type": "integer",
          "unit": "count",
          "scale": 1,
          "transform": null,
          "metric": "inlet_phases.index"
        },
        "phase_label": {
          "oid_suffix": "3",
          "type": "string",
          "unit": "text",
          "scale": 1,
          "transform": null,
          "metric": "inlet_phases.phase_label"
        },
        "current_ma": {
          "oid_suffix": "4",
          "type": "integer",
          "unit": "amps",
          "scale": 1,
          "transform": null,
          "metric": "inlet_phases.current_ma"
        },
        "voltage_mv": {
          "oid_suffix": "5",
          "type": "integer",
          "unit": "volts",
          "scale": 1,
          "transform": null,
          "metric": "inlet_phases.voltage_mv"
        },
        "active_power_watts": {
          "oid_suffix": "6",
          "type": "integer",
          "unit": "watts",
          "scale": 1,
          "transform": null,
          "metric": "inlet_phases.active_power_watts"
        }
      },
      "max_rows": 256,
      "cost": 10
    }
  },
  "traps": []
}
