{
  "schema_version": 1,
  "profile_name": "proxmox-ve",
  "display_name": "Proxmox Ve",
  "description": "Proxmox VE Cluster Node (Linux Net-SNMP Extended)",
  "vendor": "Proxmox",
  "device_classes": [
    "hypervisor"
  ],
  "state": "enabled",
  "detection": {
    "sys_object_id_prefixes": [],
    "sys_descr_regexes": [
      "(?i)Proxmox"
    ],
    "required_oids": [
      "1.3.6.1.2.1.1.2.0"
    ],
    "optional_oids": [],
    "priority": 20,
    "minimum_confidence": 0.8
  },
  "poll": {
    "defaults": {
      "timeout_ms": 1000,
      "retries": 1,
      "max_parallel": 4,
      "budget_weight": 1
    }
  },
  "scalars": {
    "cpu_system_load_1min": {
      "oid": "1.3.6.1.4.1.2021.10.1.3.1",
      "type": "gauge",
      "unit": "percent",
      "scale": 1,
      "transform": null,
      "metric": "cpu_system_load_1min",
      "required": false,
      "priority": 0,
      "timeout_ms": null
    },
    "cpu_system_load_5min": {
      "oid": "1.3.6.1.4.1.2021.10.1.3.2",
      "type": "gauge",
      "unit": "percent",
      "scale": 1,
      "transform": null,
      "metric": "cpu_system_load_5min",
      "required": false,
      "priority": 0,
      "timeout_ms": null
    },
    "cpu_system_load_15min": {
      "oid": "1.3.6.1.4.1.2021.10.1.3.3",
      "type": "gauge",
      "unit": "percent",
      "scale": 1,
      "transform": null,
      "metric": "cpu_system_load_15min",
      "required": false,
      "priority": 0,
      "timeout_ms": null
    },
    "ram_total_kb": {
      "oid": "1.3.6.1.4.1.2021.4.5.0",
      "type": "gauge",
      "unit": "bytes",
      "scale": 1,
      "transform": null,
      "metric": "ram_total_kb",
      "required": false,
      "priority": 0,
      "timeout_ms": null
    },
    "ram_available_kb": {
      "oid": "1.3.6.1.4.1.2021.4.6.0",
      "type": "enum",
      "unit": "status",
      "scale": 1,
      "transform": null,
      "metric": "ram_available_kb",
      "required": false,
      "priority": 0,
      "timeout_ms": null
    }
  },
  "tables": {
    "running_processes": {
      "base_oid": "1.3.6.1.2.1.25.4.2.1",
      "index_strategy": "integer",
      "columns": {
        "process_index": {
          "oid_suffix": "1",
          "type": "gauge",
          "unit": "count",
          "scale": 1,
          "transform": null,
          "metric": "running_processes.process_index"
        },
        "process_name": {
          "oid_suffix": "2",
          "type": "string",
          "unit": "text",
          "scale": 1,
          "transform": null,
          "metric": "running_processes.process_name"
        },
        "process_path": {
          "oid_suffix": "4",
          "type": "string",
          "unit": "text",
          "scale": 1,
          "transform": null,
          "metric": "running_processes.process_path"
        },
        "process_status": {
          "oid_suffix": "7",
          "type": "enum",
          "unit": "status",
          "scale": 1,
          "transform": null,
          "metric": "running_processes.process_status"
        }
      },
      "max_rows": 256,
      "cost": 10
    }
  },
  "traps": []
}
