{
  "schema_version": 1,
  "profile_name": "kentix-multisensor",
  "display_name": "Kentix Multisensor",
  "description": "Kentix Infrastructure Smart Sensor Environment Guard",
  "vendor": "Kentix",
  "device_classes": [
    "environmental-sensor"
  ],
  "state": "experimental",
  "detection": {
    "sys_object_id_prefixes": [
      "1.3.6.1.4.1.37954"
    ],
    "sys_descr_regexes": [
      "(?i)Kentix"
    ],
    "required_oids": [
      "1.3.6.1.2.1.1.2.0"
    ],
    "optional_oids": [],
    "priority": 20,
    "minimum_confidence": 0.8
  },
  "poll": {
    "defaults": {
      "timeout_ms": 1000,
      "retries": 1,
      "max_parallel": 4,
      "budget_weight": 1
    }
  },
  "scalars": {
    "temperature_celsius": {
      "oid": "1.3.6.1.4.1.37954.1.1.1.0",
      "type": "integer",
      "unit": "celsius",
      "scale": 0.1,
      "transform": null,
      "metric": "temperature_celsius",
      "required": false,
      "priority": 0,
      "timeout_ms": null
    },
    "humidity_pct": {
      "oid": "1.3.6.1.4.1.37954.1.1.2.0",
      "type": "integer",
      "unit": "percent",
      "scale": 1,
      "transform": null,
      "metric": "humidity_pct",
      "required": false,
      "priority": 0,
      "timeout_ms": null
    },
    "dewpoint_celsius": {
      "oid": "1.3.6.1.4.1.37954.1.1.3.0",
      "type": "integer",
      "unit": "celsius",
      "scale": 0.1,
      "transform": null,
      "metric": "dewpoint_celsius",
      "required": false,
      "priority": 0,
      "timeout_ms": null
    },
    "vibration_alarm": {
      "oid": "1.3.6.1.4.1.37954.1.1.6.0",
      "type": "integer",
      "unit": "count",
      "scale": 1,
      "transform": null,
      "metric": "vibration_alarm",
      "required": false,
      "priority": 0,
      "timeout_ms": null
    },
    "carbon_monoxide_co_ppm": {
      "oid": "1.3.6.1.4.1.37954.1.1.8.0",
      "type": "integer",
      "unit": "count",
      "scale": 1,
      "transform": null,
      "metric": "carbon_monoxide_co_ppm",
      "required": false,
      "priority": 0,
      "timeout_ms": null
    },
    "alarm_relay_status": {
      "oid": "1.3.6.1.4.1.37954.1.2.1.0",
      "type": "integer",
      "unit": "count",
      "scale": 1,
      "transform": null,
      "metric": "alarm_relay_status",
      "required": false,
      "priority": 0,
      "timeout_ms": null
    }
  },
  "tables": {},
  "traps": []
}
