{
  "schema_version": 1,
  "profile_name": "generic-host",
  "display_name": "Generic Host",
  "description": "Standard SNMP system and host-resource metrics for unknown servers and appliances",
  "vendor": "IETF",
  "device_classes": [
    "server",
    "appliance"
  ],
  "state": "enabled",
  "detection": {
    "sys_object_id_prefixes": [],
    "sys_descr_regexes": [],
    "required_oids": [
      "1.3.6.1.2.1.1.2.0"
    ],
    "optional_oids": [],
    "priority": 0,
    "minimum_confidence": 0.5
  },
  "poll": {
    "defaults": {
      "timeout_ms": 1000,
      "retries": 1,
      "max_parallel": 4,
      "budget_weight": 1
    }
  },
  "scalars": {
    "uptime": {
      "oid": "1.3.6.1.2.1.1.3.0",
      "type": "timeticks",
      "unit": "seconds",
      "scale": 0.01,
      "transform": null,
      "metric": "system.uptime.seconds",
      "required": true,
      "priority": 100,
      "timeout_ms": 1000
    },
    "memory_total": {
      "oid": "1.3.6.1.2.1.25.2.2.0",
      "type": "gauge",
      "unit": "bytes",
      "scale": 1024,
      "transform": null,
      "metric": "system.memory.total_bytes",
      "required": false,
      "optional": true,
      "priority": 50,
      "timeout_ms": 1000
    },
    "interfaces_count": {
      "oid": "1.3.6.1.2.1.2.1.0",
      "type": "gauge",
      "unit": "count",
      "scale": 1,
      "transform": null,
      "metric": "network.interface.count",
      "required": false,
      "optional": true,
      "priority": 40,
      "timeout_ms": 1000
    },
    "cpu_idle": {
      "oid": "1.3.6.1.4.1.2021.11.11.0",
      "type": "integer",
      "unit": "percent",
      "scale": 1,
      "transform": null,
      "metric": "system.cpu.idle_percent",
      "required": false,
      "optional": true,
      "priority": 60,
      "timeout_ms": 1000
    },
    "ucd_memory_total": {
      "oid": "1.3.6.1.4.1.2021.4.5.0",
      "type": "integer",
      "unit": "bytes",
      "scale": 1024,
      "transform": null,
      "metric": "system.memory.ucd_total_bytes",
      "required": false,
      "optional": true,
      "priority": 50,
      "timeout_ms": 1000
    },
    "ucd_memory_available": {
      "oid": "1.3.6.1.4.1.2021.4.6.0",
      "type": "integer",
      "unit": "bytes",
      "scale": 1024,
      "transform": null,
      "metric": "system.memory.available_bytes",
      "required": false,
      "optional": true,
      "priority": 45,
      "timeout_ms": 1000
    }
  },
  "tables": {},
  "traps": []
}