{
  "schema_version": 1,
  "profile_name": "checkpoint-firewall",
  "display_name": "Checkpoint Firewall",
  "description": "Check Point Security Gateway Appliance Status (CHECKPOINT-MIB)",
  "vendor": "Check Point",
  "device_classes": [
    "firewall"
  ],
  "state": "experimental",
  "detection": {
    "sys_object_id_prefixes": [
      "1.3.6.1.4.1.2620"
    ],
    "sys_descr_regexes": [
      "(?i)Check Point"
    ],
    "required_oids": [
      "1.3.6.1.2.1.1.2.0"
    ],
    "optional_oids": [],
    "priority": 20,
    "minimum_confidence": 0.8
  },
  "poll": {
    "defaults": {
      "timeout_ms": 1000,
      "retries": 1,
      "max_parallel": 4,
      "budget_weight": 1
    }
  },
  "scalars": {
    "fw_status": {
      "oid": "1.3.6.1.4.1.2620.1.1.1.0",
      "type": "integer",
      "unit": "count",
      "scale": 1,
      "transform": null,
      "metric": "fw_status",
      "required": false,
      "priority": 0,
      "timeout_ms": null
    },
    "accepted_packets_count": {
      "oid": "1.3.6.1.4.1.2620.1.1.4.0",
      "type": "counter",
      "unit": "count",
      "scale": 1,
      "transform": null,
      "metric": "accepted_packets_count",
      "required": false,
      "priority": 0,
      "timeout_ms": null
    },
    "dropped_packets_count": {
      "oid": "1.3.6.1.4.1.2620.1.1.5.0",
      "type": "counter",
      "unit": "count",
      "scale": 1,
      "transform": null,
      "metric": "dropped_packets_count",
      "required": false,
      "priority": 0,
      "timeout_ms": null
    },
    "current_connections": {
      "oid": "1.3.6.1.4.1.2620.1.1.25.1.0",
      "type": "integer",
      "unit": "amps",
      "scale": 1,
      "transform": null,
      "metric": "current_connections",
      "required": false,
      "priority": 0,
      "timeout_ms": null
    },
    "connections_peak": {
      "oid": "1.3.6.1.4.1.2620.1.1.25.2.0",
      "type": "integer",
      "unit": "count",
      "scale": 1,
      "transform": null,
      "metric": "connections_peak",
      "required": false,
      "priority": 0,
      "timeout_ms": null
    }
  },
  "tables": {},
  "traps": []
}
