{
  "schema_version": 1,
  "profile_name": "apc-netbotz",
  "display_name": "Apc Netbotz",
  "description": "APC NetBotz Environmental and Rack Access Monitoring",
  "vendor": "APC",
  "device_classes": [
    "environmental-sensor"
  ],
  "state": "experimental",
  "detection": {
    "sys_object_id_prefixes": [
      "1.3.6.1.4.1.5528"
    ],
    "sys_descr_regexes": [
      "(?i)NetBotz",
      "(?i)APC"
    ],
    "required_oids": [
      "1.3.6.1.2.1.1.2.0"
    ],
    "optional_oids": [],
    "priority": 20,
    "minimum_confidence": 0.8
  },
  "poll": {
    "defaults": {
      "timeout_ms": 1000,
      "retries": 1,
      "max_parallel": 4,
      "budget_weight": 1
    }
  },
  "scalars": {
    "enclosure_count": {
      "oid": "1.3.6.1.4.1.5528.100.10.1.1.0",
      "type": "integer",
      "unit": "count",
      "scale": 1,
      "transform": null,
      "metric": "enclosure_count",
      "required": false,
      "priority": 0,
      "timeout_ms": null
    }
  },
  "tables": {
    "door_sensors": {
      "base_oid": "1.3.6.1.4.1.5528.100.10.2.1.1",
      "index_strategy": "integer",
      "columns": {
        "index": {
          "oid_suffix": "1",
          "type": "integer",
          "unit": "count",
          "scale": 1,
          "transform": null,
          "metric": "door_sensors.index"
        },
        "sensor_id": {
          "oid_suffix": "2",
          "type": "string",
          "unit": "text",
          "scale": 1,
          "transform": null,
          "metric": "door_sensors.sensor_id"
        },
        "door_state": {
          "oid_suffix": "4",
          "type": "integer",
          "unit": "count",
          "scale": 1,
          "transform": null,
          "metric": "door_sensors.door_state"
        }
      },
      "max_rows": 256,
      "cost": 10
    },
    "fluid_sensors": {
      "base_oid": "1.3.6.1.4.1.5528.100.10.2.2.1",
      "index_strategy": "integer",
      "columns": {
        "index": {
          "oid_suffix": "1",
          "type": "integer",
          "unit": "count",
          "scale": 1,
          "transform": null,
          "metric": "fluid_sensors.index"
        },
        "sensor_id": {
          "oid_suffix": "2",
          "type": "string",
          "unit": "text",
          "scale": 1,
          "transform": null,
          "metric": "fluid_sensors.sensor_id"
        },
        "leak_detected": {
          "oid_suffix": "4",
          "type": "integer",
          "unit": "count",
          "scale": 1,
          "transform": null,
          "metric": "fluid_sensors.leak_detected"
        }
      },
      "max_rows": 256,
      "cost": 10
    }
  },
  "traps": []
}
