{
  "schema_version": 1,
  "profile_name": "openwrt-router",
  "display_name": "Openwrt Router",
  "description": "OpenWrt Embedded Router with Wireless Metrics",
  "vendor": "OpenWrt",
  "device_classes": [
    "firewall"
  ],
  "state": "experimental",
  "detection": {
    "sys_object_id_prefixes": [
      "1.3.6.1.4.1.2021"
    ],
    "sys_descr_regexes": [
      "(?i)OpenWrt"
    ],
    "required_oids": [
      "1.3.6.1.2.1.1.2.0"
    ],
    "optional_oids": [],
    "priority": 20,
    "minimum_confidence": 0.8
  },
  "poll": {
    "defaults": {
      "timeout_ms": 1000,
      "retries": 1,
      "max_parallel": 4,
      "budget_weight": 1
    }
  },
  "scalars": {
    "system_entropy": {
      "oid": "1.3.6.1.4.1.2021.53.1.0",
      "type": "integer",
      "unit": "count",
      "scale": 1,
      "transform": null,
      "metric": "system_entropy",
      "required": false,
      "priority": 0,
      "timeout_ms": null
    },
    "dhcp_leases_count": {
      "oid": "1.3.6.1.4.1.2021.53.2.0",
      "type": "integer",
      "unit": "count",
      "scale": 1,
      "transform": null,
      "metric": "dhcp_leases_count",
      "required": false,
      "priority": 0,
      "timeout_ms": null
    }
  },
  "tables": {
    "wifi_interfaces": {
      "base_oid": "1.3.6.1.4.1.2021.53.3.1",
      "index_strategy": "integer",
      "columns": {
        "index": {
          "oid_suffix": "1",
          "type": "integer",
          "unit": "count",
          "scale": 1,
          "transform": null,
          "metric": "wifi_interfaces.index"
        },
        "interface": {
          "oid_suffix": "2",
          "type": "string",
          "unit": "text",
          "scale": 1,
          "transform": null,
          "metric": "wifi_interfaces.interface"
        },
        "ssid": {
          "oid_suffix": "3",
          "type": "string",
          "unit": "text",
          "scale": 1,
          "transform": null,
          "metric": "wifi_interfaces.ssid"
        },
        "connected_clients": {
          "oid_suffix": "4",
          "type": "integer",
          "unit": "count",
          "scale": 1,
          "transform": null,
          "metric": "wifi_interfaces.connected_clients"
        },
        "noise_floor": {
          "oid_suffix": "5",
          "type": "integer",
          "unit": "decibels",
          "scale": 1,
          "transform": null,
          "metric": "wifi_interfaces.noise_floor"
        }
      },
      "max_rows": 256,
      "cost": 10
    }
  },
  "traps": []
}
